{
  "schemaVersion": 1,
  "registryVersion": "2026.08.16-alpha.1",
  "generatedFrom": {
    "kind": "github-topic+npm-search",
    "asOf": "2026-08-16",
    "sha256": "4dedd1426be708fcbed0b01841979e3d504c3b9408fdf61748917830b8141662"
  },
  "plugins": [
    {
      "schemaVersion": 1,
      "id": "aegis",
      "package": "aegis",
      "version": "2.8.1",
      "source": {
        "kind": "github-sha",
        "spec": "github:GanyuanRan/Aegis#c8483d63f5b3826bebf30ec6cf84d76cdab03907",
        "commit": "c8483d63f5b3826bebf30ec6cf84d76cdab03907"
      },
      "compatibility": {
        "dsh": "unknown"
      },
      "platforms": [],
      "license": "MIT",
      "lifecycleScripts": {},
      "permissions": [],
      "credentials": [],
      "verification": {
        "state": "failed",
        "verifiedAt": "2026-08-16T09:08:45.803Z",
        "dshVersion": "0.1.0-rc.6",
        "platform": "win32",
        "environment": {
          "os": "win32",
          "arch": "x64",
          "node": "v25.2.0"
        },
        "evidence": [
          "https://github.com/GanyuanRan/Aegis",
          "registry/verifications/aegis.json",
          "https://github.com/Harzva/harness-flow-hub/blob/registry-v2026.08.16-alpha.1/registry/verifications/aegis.json"
        ]
      }
    },
    {
      "schemaVersion": 1,
      "id": "anionex--dsh-vision-toolkit",
      "package": "@anionex/dsh-vision-toolkit",
      "version": "0.1.8",
      "source": {
        "kind": "github-sha",
        "spec": "github:Anionex/dsh-vision-toolkit#5cd1279d9a5a98bb634093dadcd73ea2a396a74e",
        "commit": "5cd1279d9a5a98bb634093dadcd73ea2a396a74e"
      },
      "compatibility": {
        "dsh": "unknown"
      },
      "platforms": [],
      "license": "MIT",
      "lifecycleScripts": {
        "build": "node scripts/upstream-manifest.mjs && node scripts/clean-build.mjs && tsc -p tsconfig.json && tsc -p tsconfig.client.json && tsc -p tsconfig.client.public.json && node scripts/build-client.mjs",
        "prepack": "npm run build",
        "test": "vitest run tests",
        "verify:portable": "node scripts/upstream-manifest.mjs && node scripts/verify-portable.mjs",
        "example:ui-restoration": "node scripts/run-ui-restoration-example.mjs --check",
        "example:ui-restoration:write": "node scripts/run-ui-restoration-example.mjs --write",
        "upstream:manifest": "node scripts/upstream-manifest.mjs --write",
        "upstream:sync": "node scripts/sync-upstream.mjs"
      },
      "permissions": [],
      "credentials": [],
      "verification": {
        "state": "failed",
        "verifiedAt": "2026-08-16T09:30:11.991Z",
        "dshVersion": "0.1.0-rc.6",
        "platform": "win32",
        "environment": {
          "os": "win32",
          "arch": "x64",
          "node": "v25.2.0"
        },
        "evidence": [
          "https://github.com/Anionex/dsh-vision-toolkit",
          "registry/verifications/anionex--dsh-vision-toolkit.json",
          "https://github.com/Harzva/harness-flow-hub/blob/registry-v2026.08.16-alpha.1/registry/verifications/anionex--dsh-vision-toolkit.json"
        ]
      }
    },
    {
      "schemaVersion": 1,
      "id": "deepseek-harness-tui--dsh-tui",
      "package": "@deepseek-harness-tui/dsh-tui",
      "version": "0.7.1",
      "source": {
        "kind": "github-sha",
        "spec": "github:ccch1mneyyy/dsh-TUI#b3baa5eb5efa0297011e82d52f1e2437b1760363",
        "commit": "b3baa5eb5efa0297011e82d52f1e2437b1760363"
      },
      "compatibility": {
        "dsh": "unknown"
      },
      "platforms": [],
      "license": "MIT",
      "lifecycleScripts": {
        "clean": "node scripts/clean-lib.mjs",
        "compile": "npm run clean && tsc -p tsconfig.json",
        "prepare": "npm run compile",
        "build": "npm run compile && npm run verify:build",
        "tui": "node --import tsx/esm scripts/run.ts",
        "smoke": "node --import tsx/esm scripts/smoke.tsx",
        "verify:build": "npm run verify:boundary && npm run verify:contract && npm run verify:patch-surface",
        "verify:boundary": "node --import tsx/esm scripts/verify-adapter-boundary.ts",
        "verify:contract": "node --import tsx/esm scripts/verify-upstream-contract.ts",
        "verify:patch-surface": "node --import tsx/esm scripts/verify-patch-surface.ts",
        "verify:package": "npm pack --dry-run --json --ignore-scripts | node scripts/verify-package.mjs",
        "verify:clipboard-image": "node --import tsx/esm scripts/verify-clipboard-image.ts"
      },
      "permissions": [],
      "credentials": [],
      "verification": {
        "state": "unverified",
        "evidence": [
          "https://github.com/ccch1mneyyy/dsh-TUI"
        ]
      }
    },
    {
      "schemaVersion": 1,
      "id": "dsh-any-background",
      "package": "dsh-any-background",
      "version": "0.1.5",
      "source": {
        "kind": "npm",
        "spec": "dsh-any-background@0.1.5",
        "integrity": "sha512-bvpAHho7Xz/FfwKcXb+NrIc/BXiNyeIWxVB6Bgi0PcO5zW2DjH1mI3qByhqbAIAhi4MFEYOul583I6miggl8Mg=="
      },
      "compatibility": {
        "dsh": "unknown"
      },
      "platforms": [],
      "license": "MIT",
      "lifecycleScripts": {
        "watch": "tsdown --watch",
        "bundle": "tsdown"
      },
      "permissions": [],
      "credentials": [],
      "verification": {
        "state": "unverified",
        "verifiedAt": "2026-08-16T09:22:12.563Z",
        "dshVersion": "0.1.0-rc.6",
        "platform": "win32",
        "environment": {
          "os": "win32",
          "arch": "x64",
          "node": "v25.2.0"
        },
        "evidence": [
          "https://www.npmjs.com/package/dsh-any-background",
          "registry/verifications/dsh-any-background.json",
          "https://github.com/Harzva/harness-flow-hub/blob/registry-v2026.08.16-alpha.1/registry/verifications/dsh-any-background.json"
        ]
      }
    },
    {
      "schemaVersion": 1,
      "id": "dsh-auto-review",
      "package": "dsh-auto-review",
      "version": "0.4.1",
      "source": {
        "kind": "npm",
        "spec": "dsh-auto-review@0.4.1",
        "integrity": "sha512-6no+JH0brlW6Pq/QWcI3RVJ20KaV3Zw9fcyqbg2XIWBtVyH1OrHWuCDoC20axAKt5qPiYTxTaB4DpuEKjo+2TQ=="
      },
      "compatibility": {
        "dsh": "unknown"
      },
      "platforms": [],
      "license": "Apache-2.0",
      "lifecycleScripts": {
        "test": "vitest run",
        "build": "node scripts/prepare.mjs",
        "typecheck": "tsc -p tsconfig.json --noEmit && tsc -p tsconfig.test.json --noEmit",
        "verify:self-contained": "node scripts/verify-self-contained.mjs"
      },
      "permissions": [],
      "credentials": [],
      "verification": {
        "state": "failed",
        "verifiedAt": "2026-08-16T09:25:34.032Z",
        "dshVersion": "0.1.0-rc.6",
        "platform": "win32",
        "environment": {
          "os": "win32",
          "arch": "x64",
          "node": "v25.2.0"
        },
        "evidence": [
          "https://www.npmjs.com/package/dsh-auto-review",
          "registry/verifications/dsh-auto-review.json",
          "https://github.com/Harzva/harness-flow-hub/blob/registry-v2026.08.16-alpha.1/registry/verifications/dsh-auto-review.json"
        ]
      }
    },
    {
      "schemaVersion": 1,
      "id": "dsh-better-sidebar",
      "package": "dsh-better-sidebar",
      "version": "0.12.2",
      "source": {
        "kind": "github-sha",
        "spec": "github:omdsh-dev/DSH-better-sidebar#3c196fffc3274bb30367a8fff77f46eff5005d2c",
        "commit": "3c196fffc3274bb30367a8fff77f46eff5005d2c"
      },
      "compatibility": {
        "dsh": "unknown"
      },
      "platforms": [],
      "license": "MIT",
      "lifecycleScripts": {
        "build": "rm -rf lib && tsc -p tsconfig.build.json && tsdown",
        "prepublishOnly": "pnpm build",
        "typecheck": "tsc --noEmit",
        "bundle": "tsdown",
        "watch": "tsdown --watch",
        "prepare": "tsdown",
        "test": "vitest run",
        "test:mount": "bash scripts/e2e-mount.sh",
        "check:consumer-types": "bash scripts/check-consumer-types.sh"
      },
      "permissions": [],
      "credentials": [],
      "verification": {
        "state": "failed",
        "verifiedAt": "2026-08-16T09:31:43.900Z",
        "dshVersion": "0.1.0-rc.6",
        "platform": "win32",
        "environment": {
          "os": "win32",
          "arch": "x64",
          "node": "v25.2.0"
        },
        "evidence": [
          "https://github.com/omdsh-dev/DSH-better-sidebar",
          "registry/verifications/dsh-better-sidebar.json",
          "https://github.com/Harzva/harness-flow-hub/blob/registry-v2026.08.16-alpha.1/registry/verifications/dsh-better-sidebar.json"
        ]
      }
    },
    {
      "schemaVersion": 1,
      "id": "dsh-external--dsh-ads",
      "package": "@dsh-external/dsh-ads",
      "version": "0.1.0",
      "source": {
        "kind": "github-sha",
        "spec": "github:Nagi-ovo/dsh-ads#fbd58579e4f3601b2c38ccbf3f7f854c9f3a9cd6",
        "commit": "fbd58579e4f3601b2c38ccbf3f7f854c9f3a9cd6"
      },
      "compatibility": {
        "dsh": "unknown"
      },
      "platforms": [],
      "license": "BSD-3-Clause",
      "lifecycleScripts": {
        "assets": "node scripts/build-english-artwork.mjs && node scripts/build-assets.mjs && node scripts/build-contrib.mjs",
        "build": "tsdown",
        "typecheck": "tsc -p tsconfig.json && tsc -p tsconfig.client.json",
        "test": "vitest run",
        "check": "pnpm run typecheck && pnpm run test && pnpm run build",
        "catalog": "node scripts/build-catalog.mjs"
      },
      "permissions": [],
      "credentials": [],
      "verification": {
        "state": "failed",
        "verifiedAt": "2026-08-16T09:28:40.296Z",
        "dshVersion": "0.1.0-rc.6",
        "platform": "win32",
        "environment": {
          "os": "win32",
          "arch": "x64",
          "node": "v25.2.0"